{
  "schema_version":"1.0","task_id":"P1-09-1","reference_author":"codex_gpt_simulated_expert","reference_status":"verified","question":"Relate DuPont's 2030 renewable-power sourcing target to its 2024 result, stating the target, result, and whether the target had already been exceeded.","answer_status":"verified_fact",
  "answer":{"2030_target_percent":60,"2024_result_percent":61,"status":"exceeded by 1 percentage point"},"normalized_value":61,"normalized_unit":"%","reported_unit":"% of electric power","subject":"DuPont","scope_boundary":"electric power to operations; renewable sources including RECs","period":"2024 result against 2030 target","calculation":{"expression":"61 - 60","inputs":[61,60],"unrounded_result":1,"rounding_rule":"exact percentage-point difference"},
  "evidence":[{"document_id":"DD-SR-2025","document_sha256":"a6ccd9ed842ceeb3c46074ded124d4034211c70afe887994e6c126d8020cfa12","pdf_page":21,"printed_page":null,"verbatim_excerpt":"61% of electric power to our operations is from renewable sources ... surpassing our 2030 goal.","role":"claim_support"},{"document_id":"DD-SR-2025","document_sha256":"a6ccd9ed842ceeb3c46074ded124d4034211c70afe887994e6c126d8020cfa12","pdf_page":93,"printed_page":"A21","verbatim_excerpt":"DuPont has a target to source 60% of power to operations from renewable sources, including RECs, by 2030.","role":"claim_support"}],
  "search_record":{"pages_reviewed":[21,23,93],"terms_used":["60%","61%","renewable"],"notes":"Target and result cross-checked."},"controlled_intervention_id":null,"provenance_attestation":{"is_human":false,"is_ai_simulation":true,"candidate_model_excluded":true}
}
