{
  "schema_version": "1.0",
  "task_id": "P1-01-1",
  "reference_author": "codex_gpt_simulated_expert",
  "reference_status": "verified",
  "question": "What absolute amount of methane (CH4) emissions did Apple report for fiscal 2024, expressed in metric tons of CO2 equivalent?",
  "answer_status": "insufficient_information",
  "answer": null,
  "normalized_value": null,
  "normalized_unit": "tCO2e",
  "reported_unit": null,
  "subject": "Apple Inc.",
  "scope_boundary": "fiscal 2024 environmental disclosures",
  "period": "2024-09-30 fiscal year end",
  "calculation": null,
  "evidence": [],
  "search_record": {
    "pages_reviewed": [12, 13, 22, 27, 30, 104, 105, 106, 107, 125, 126],
    "terms_used": ["methane", "CH4", "greenhouse gas", "Scope 1"],
    "notes": "The report covers CH4 within its GHG inventory but no separate absolute FY2024 methane amount was found. Exposed eligibility pages are search provenance only and are not task target pages."
  },
  "controlled_intervention_id": null,
  "provenance_attestation": {"is_human": false, "is_ai_simulation": true, "candidate_model_excluded": true}
}
